{
  "intersection_id": "SITE1",
  "location": {
    "city": "Amman",
    "country": "Jordan",
    "lat": 31.9583,
    "lon": 35.9072
  },
  "camera": {
    "stream_url": "rtsp://localhost:8554/site1",
    "resolution": [
      1920,
      1080
    ],
    "fps": 10,
    "fov_deg": 90,
    "mounting_height_m": 8.0,
    "bearing_deg": 180
  },
  "approaches": [
    {
      "name": "N",
      "direction_bearing_deg": 0,
      "lanes": [
        {
          "id": "N-1",
          "type": "right",
          "detector_id": "DET-N-1-1",
          "width_m": 3.2
        },
        {
          "id": "N-2",
          "type": "through",
          "detector_id": "DET-N-2-1",
          "width_m": 3.5
        },
        {
          "id": "N-3",
          "type": "through",
          "detector_id": "DET-N-3-1",
          "width_m": 3.5
        },
        {
          "id": "N-4",
          "type": "through",
          "detector_id": "DET-N-4-1",
          "width_m": 3.5
        },
        {
          "id": "N-5",
          "type": "left",
          "detector_id": "DET-N-5-1",
          "width_m": 3.2
        }
      ]
    },
    {
      "name": "S",
      "direction_bearing_deg": 180,
      "lanes": [
        {
          "id": "S-1",
          "type": "right",
          "detector_id": "DET-S-1-1",
          "width_m": 3.2
        },
        {
          "id": "S-2",
          "type": "through",
          "detector_id": "DET-S-2-1",
          "width_m": 3.5
        },
        {
          "id": "S-3",
          "type": "through",
          "detector_id": "DET-S-3-1",
          "width_m": 3.5
        },
        {
          "id": "S-4",
          "type": "through",
          "detector_id": "DET-S-4-1",
          "width_m": 3.5
        },
        {
          "id": "S-5",
          "type": "left",
          "detector_id": "DET-S-5-1",
          "width_m": 3.2
        }
      ]
    },
    {
      "name": "E",
      "direction_bearing_deg": 90,
      "lanes": [
        {
          "id": "E-1",
          "type": "right",
          "detector_id": "DET-E-1-1",
          "width_m": 3.2
        },
        {
          "id": "E-2",
          "type": "through",
          "detector_id": "DET-E-2-1",
          "width_m": 3.3
        },
        {
          "id": "E-3",
          "type": "through",
          "detector_id": "DET-E-3-1",
          "width_m": 3.3
        },
        {
          "id": "E-4",
          "type": "left",
          "detector_id": "DET-E-4-1",
          "width_m": 3.2
        }
      ]
    },
    {
      "name": "W",
      "direction_bearing_deg": 270,
      "lanes": [
        {
          "id": "W-1",
          "type": "right",
          "detector_id": "DET-W-1-1",
          "width_m": 3.2
        },
        {
          "id": "W-2",
          "type": "through",
          "detector_id": "DET-W-2-1",
          "width_m": 3.3
        },
        {
          "id": "W-3",
          "type": "through",
          "detector_id": "DET-W-3-1",
          "width_m": 3.3
        },
        {
          "id": "W-4",
          "type": "left",
          "detector_id": "DET-W-4-1",
          "width_m": 3.2
        }
      ]
    }
  ],
  "stop_lines": [
    {
      "approach": "N",
      "polyline_px": [
        [
          620,
          540
        ],
        [
          1020,
          540
        ]
      ]
    },
    {
      "approach": "S",
      "polyline_px": [
        [
          780,
          780
        ],
        [
          1140,
          780
        ]
      ]
    },
    {
      "approach": "E",
      "polyline_px": [
        [
          1360,
          620
        ],
        [
          1360,
          780
        ]
      ]
    },
    {
      "approach": "W",
      "polyline_px": [
        [
          460,
          620
        ],
        [
          460,
          780
        ]
      ]
    }
  ],
  "monitoring_zones": [
    {
      "name": "queue_spillback_N",
      "kind": "queue_spillback",
      "polygon_px": [
        [
          620,
          400
        ],
        [
          1020,
          400
        ],
        [
          1020,
          540
        ],
        [
          620,
          540
        ]
      ]
    },
    {
      "name": "queue_spillback_S",
      "kind": "queue_spillback",
      "polygon_px": [
        [
          780,
          780
        ],
        [
          1140,
          780
        ],
        [
          1140,
          960
        ],
        [
          780,
          960
        ]
      ]
    },
    {
      "name": "queue_spillback_E",
      "kind": "queue_spillback",
      "polygon_px": [
        [
          1360,
          620
        ],
        [
          1620,
          620
        ],
        [
          1620,
          780
        ],
        [
          1360,
          780
        ]
      ]
    },
    {
      "name": "queue_spillback_W",
      "kind": "queue_spillback",
      "polygon_px": [
        [
          200,
          620
        ],
        [
          460,
          620
        ],
        [
          460,
          780
        ],
        [
          200,
          780
        ]
      ]
    },
    {
      "name": "conflict_zone_center",
      "kind": "conflict_zone",
      "polygon_px": [
        [
          620,
          560
        ],
        [
          1140,
          560
        ],
        [
          1360,
          620
        ],
        [
          1360,
          780
        ],
        [
          780,
          780
        ],
        [
          460,
          780
        ],
        [
          460,
          620
        ]
      ]
    },
    {
      "name": "ped_crossing_center",
      "kind": "ped_crossing",
      "polygon_px": [
        [
          820,
          640
        ],
        [
          1080,
          640
        ],
        [
          1080,
          700
        ],
        [
          820,
          700
        ]
      ]
    }
  ],
  "signal_plan_ref": "phase1-sandbox/configs/phase_plan.yml"
}
